{
    "schemaVersion": 1,
    "kind": "nuri.baseline.approval",
    "caseId": "correctness.procedural.ddgi_dirty_light_before_360p",
    "suite": "correctness",
    "profileId": "local-nvrhi-visible",
    "backend": "default",
    "resolvedBackend": "nvrhi",
    "reason": "User-authorized stable DDGI visual baseline; Hybrid coverage excluded in favor of SceneFit",
    "actor": "Codex",
    "approvedAtUtc": "2026-07-28T08:26:58Z",
    "sourceCommit": "698d4e86f6923f1ca26185f3b1a5c1045273740d",
    "sourceDigest": "sha256:261c737f97ac3ea5c8b49687aa4e4deb5e98f08e238b95d7ef85459bc4b2e19e",
    "planDigest": "sha256:f44052f79050fc39368d2419f93717d50b72b62a724619cb0f6754131bcf276c",
    "captures": [
        {
            "target": "final_color",
            "newHash": "sha256:7bdd5d5670b99f2778b45c08000e1b825a1431f7a094b71f3f260c9af36a749e"
        },
        {
            "target": "ddgi_dirty_region_debug_preview",
            "newHash": "sha256:c01aeb626454955eb615127db648739545cc91fe88edb8279000835df62b2a7b"
        }
    ]
}