{
    "schemaVersion": 1,
    "kind": "nuri.baseline.approval",
    "caseId": "correctness.procedural.ddgi_dynamic_settled_360p",
    "suite": "correctness",
    "profileId": "local-nvrhi-visible",
    "backend": "default",
    "resolvedBackend": "nvrhi",
    "reason": "User-authorized stable DDGI visual baseline; Hybrid coverage excluded in favor of SceneFit",
    "actor": "Codex",
    "approvedAtUtc": "2026-07-28T08:27:30Z",
    "sourceCommit": "698d4e86f6923f1ca26185f3b1a5c1045273740d",
    "sourceDigest": "sha256:629bf1ce9fae43ccfc0fe765bdbd7c452315089cca6780b93d340be38742bc40",
    "planDigest": "sha256:b44b34150dbd2c0ac71bc23cad2ecc2a5e9760ac727e1228d54c645548a8d7f4",
    "captures": [
        {
            "target": "final_color",
            "newHash": "sha256:46ce645f612a9764b26cee04801e7524edcffdf28a542f1803afb300162e07cf"
        },
        {
            "target": "ddgi_debug_preview",
            "newHash": "sha256:500c269c4544f9e76babb50b5c28190e3872631968d1bbfa23a81e71389f514b"
        },
        {
            "target": "ddgi_volume0_irradiance_atlas",
            "newHash": "sha256:51f316b864a5120ff2119c33013fec1a8f1aa2a6c3acc1527fcb324ce6a01a84"
        },
        {
            "target": "ddgi_volume0_distance_atlas",
            "newHash": "sha256:e79eaac51cb291d077c98c89c0acd72b3c810d6da2dd5fe532051cb927dcbe68"
        }
    ]
}