{
    "schemaVersion": 1,
    "kind": "nuri.baseline.approval",
    "caseId": "correctness.procedural.ddgi_color_bleed_360p",
    "suite": "correctness",
    "profileId": "local-nvrhi-visible",
    "backend": "default",
    "resolvedBackend": "nvrhi",
    "reason": "User-authorized stable DDGI visual baseline; Hybrid coverage excluded in favor of SceneFit",
    "actor": "Codex",
    "approvedAtUtc": "2026-07-28T08:25:41Z",
    "sourceCommit": "698d4e86f6923f1ca26185f3b1a5c1045273740d",
    "sourceDigest": "sha256:7a2d35aae380163488f8f9c6f23ee167b1af2dba7b83f656512c01f957c07dde",
    "planDigest": "sha256:c8b582b41ce75b4d756263faf47f26c0df17f94a37f8950fa45f8f51c5d65131",
    "captures": [
        {
            "target": "final_color",
            "newHash": "sha256:ce62840edcce56f7d2a49a12a72363691e2a23d67da3a1e1b5e384e680f9e530"
        },
        {
            "target": "ddgi_debug_preview",
            "newHash": "sha256:b2518edf47cc17f2610a7589e7ce1a851958f2bc5f0f8aeb687f950ab5af34e3"
        },
        {
            "target": "ddgi_volume0_irradiance_atlas",
            "newHash": "sha256:6ae0a4b8c7305dcdefd4f12ecbc990e53a73d3463a7555fb60ff442543abdea5"
        },
        {
            "target": "ddgi_volume0_distance_atlas",
            "newHash": "sha256:7aab91ac6a2af0ef4e04d13658fa332be76f1b9143acde5aeedd2ca203c052f8"
        }
    ]
}