{
    "schemaVersion": 1,
    "kind": "nuri.baseline.approval",
    "caseId": "renderer.niagara_bistro.meshlet_gtao_motion_360p",
    "suite": "renderer",
    "profileId": "local-nvrhi-visible",
    "backend": "nvrhi",
    "resolvedBackend": "nvrhi",
    "reason": "Reviewed renderer refactor migration with Ultra GTAO, TAA, and shadows",
    "actor": "codex",
    "approvedAtUtc": "2026-07-15T13:42:42Z",
    "sourceCommit": "3d838d1fa5f150d35f802685ddd0d2f84863effb",
    "sourceDigest": "sha256:e9b00c17ed7d42201cfe0156152e9310f7bd369e3ad37fe374df9eb5608edb97",
    "planDigest": "sha256:835e899974dc82ab7c36e0237609a6f7d65f06935820c3ec21197131debeaf4c",
    "captures": [
        {
            "target": "final_color",
            "newHash": "sha256:ddd0dede45ec14a868c1f967ab3d062fcb0626a0e92f554ed27e5f2e44de7f6a"
        },
        {
            "target": "scene_depth",
            "newHash": "sha256:bbef96e3668146d238794a2da68e606f984a47cd09c2e9922df0934a57fc310c"
        },
        {
            "target": "material_normals",
            "newHash": "sha256:bcff595d6a115c2c1748616c959103b7ebb91b96b57e35f7e4f2e498655fc7b3"
        },
        {
            "target": "ambient_occlusion",
            "newHash": "sha256:6e063c21ef1c2e661f0af9d98e40a5cb2a0780ea27081644ab7c0eb7b72d655d"
        }
    ]
}