{
    "schemaVersion": 1,
    "kind": "nuri.baseline.approval",
    "caseId": "correctness.procedural.ddgi_alpha_cutout_sided_360p",
    "suite": "correctness",
    "profileId": "local-nvrhi-visible",
    "backend": "default",
    "resolvedBackend": "nvrhi",
    "reason": "User-authorized stable DDGI visual baseline; Hybrid coverage excluded in favor of SceneFit",
    "actor": "Codex",
    "approvedAtUtc": "2026-07-28T08:24:26Z",
    "sourceCommit": "698d4e86f6923f1ca26185f3b1a5c1045273740d",
    "sourceDigest": "sha256:10018c8fedbf9977fb35ff743f003e6b867ce6223164165f88c78abdca65c42b",
    "planDigest": "sha256:74f67d35a6f2c69daeba8e86b5e96c0b9461efcd7dd946dbb4e70bea87ad34ae",
    "captures": [
        {
            "target": "final_color",
            "newHash": "sha256:32b8fbbcef66075bdde963eb651a6ab45c67b8100da7521e1c0809e0c9274014"
        },
        {
            "target": "ddgi_debug_preview",
            "newHash": "sha256:4b791f1204754cbbad39d7a0c6f9b6a865b8053853ecae0efc6ec7f27da6cf5d"
        },
        {
            "target": "ddgi_volume0_irradiance_atlas",
            "newHash": "sha256:8b48fdc63ebdf720b98bafcb9f8055118d7e65fc01445701bb2a95967fff6ca1"
        },
        {
            "target": "ddgi_volume0_distance_atlas",
            "newHash": "sha256:36adc7ad8896f17d778ecbf4b2c97f52fd7544e9ed4d8b643c214b7681e7e8d6"
        }
    ]
}